{
  "token_kind": "handle_grant",
  "token_id": "hg_fixture_handle_grant_1",
  "token_hash": "sha256:dddddddddddddddddddddddddddddddddddddddddddddddddddddddddddddddd",
  "audience": {
    "plugin_instance_id": "plugini_fixture_1",
    "active_fingerprint": "sha256:bbbbbbbbbbbbbbbbbbbbbbbbbbbbbbbbbbbbbbbbbbbbbbbbbbbbbbbbbbbbbbbb",
    "owner_session_hash": "owner_session_hash_fixture_1",
    "owner_user_hash": "owner_user_hash_fixture_1",
    "owner_env_hash": "owner_env_hash_fixture_1",
    "session_channel_id_hash": "session_channel_id_hash_fixture_1",
    "runtime_generation_id": "runtime_gen_fixture_1",
    "handle_id": "storage:settings",
    "method": "storage.kv",
    "resource_scope": {
      "kind": "user",
      "owner_env_hash": "owner_env_hash_fixture_1",
      "owner_user_hash": "owner_user_hash_fixture_1"
    }
  },
  "revision": {
    "policy_revision": 2,
    "management_revision": 3,
    "revoke_epoch": 4
  },
  "issued_at": "2026-07-12T00:00:00Z",
  "expires_at": "2026-07-12T00:01:00Z",
  "nonce": "handle_grant_nonce_fixture_1",
  "use": "reusable",
  "consumed": false,
  "revoked": false
}
